{
  "run_id": "personal-mode-20260913",
  "dispatch_id": "pm-002",
  "producer_id": "/root/private_lifecycle_integrator",
  "mandate_revision": "1",
  "milestone": "private-workflow-lifecycle",
  "schema": "implement-rfc.milestone-return.v2",
  "disposition": "milestone-complete",
  "summary": "Public personal workflow planning, board, paired lanes, scoped product commits, exact normal-contributor adoption and dual-repository recovery pass the bound offline lifecycle exits.",
  "candidate_revision": "f15b8cc390e74ed5288536b1ee454985a3c5dcaf",
  "handoff_ref": "docs/issues/10-backlog/ASK-0082-close-personal-implement-rfc.md",
  "ownership": "quiescent",
  "next_objective": "Implement personal host role loading, MASK readiness and companion external-state integration under ASK-0079 and ASK-0080; retain later native Codex/Claude qualification and pack closeout requirements.",
  "required_pending": [],
  "evidence_refs": [
    "docs/rfcs/plans/personal-implement-rfc/ASK-0076.acceptance.json",
    "docs/rfcs/plans/personal-implement-rfc/ASK-0076.public.json",
    "docs/rfcs/plans/personal-implement-rfc/ASK-0077.acceptance.json",
    "docs/rfcs/plans/personal-implement-rfc/ASK-0077.lanes.json",
    "docs/rfcs/plans/personal-implement-rfc/ASK-0078.acceptance.json",
    "docs/rfcs/plans/personal-implement-rfc/ASK-0078.commit.json"
  ],
  "binding": {
    "plan_id": "personal-implement-rfc",
    "plan_path": "docs/rfcs/plans/personal-implement-rfc/milestone-plan.json",
    "milestone_id": "private-workflow-lifecycle",
    "definition_fingerprint": "sha256:f26037a6a9c783dab1baa900f23b3d5721fa6e2046d299f9911c725fd74c2f81",
    "obligations": [
      {
        "id": "ASK-0076:*",
        "source": "ASK-0076",
        "selector": null,
        "source_fingerprint": "sha256:3d934db1e6d6309c17462e01f694994dc61dff9fa070f4a448b27aa4543d7595"
      },
      {
        "id": "ASK-0077:*",
        "source": "ASK-0077",
        "selector": null,
        "source_fingerprint": "sha256:c4ff8815f3a0880c0c370830fd7ddd69ddbbed73f6ef77f9484a8d18392b51d9"
      },
      {
        "id": "ASK-0078:*",
        "source": "ASK-0078",
        "selector": null,
        "source_fingerprint": "sha256:874fbbe7fb6c6e4ae48fb3ec7d25b81588fdfc1588ca1cdc54cbdb612c30abfa"
      }
    ],
    "obligation_fingerprint": "sha256:030667d3446fa26649d38471a75894a17dbb2c24cfe5c7c107ec4d60c97b89d1",
    "exit_criteria": [
      {
        "id": "private-workflow-lifecycle:exit:1",
        "text": "Plan intake, claim, verify, source commit, interrupt, resume and closeout use the shared public helpers with portable tracker records and local runtime receipts."
      },
      {
        "id": "private-workflow-lifecycle:exit:2",
        "text": "Paired lanes, reservations, source/tracker revision handoff, source-message and publication privacy, and pre/post commit failure recovery pass direct disposable tests."
      },
      {
        "id": "private-workflow-lifecycle:exit:3",
        "text": "Project-mode planning, board, partial acceptance, stale return, human-pending and closeout regressions remain passing."
      }
    ],
    "prerequisite_fingerprint": "sha256:6572c1149cbc3a36321fc99f1e1450b0dfd4ff0bd8fef82d81034bf5a1d310d4",
    "structural": "valid",
    "references": "resolved",
    "semantic_coverage": "unknown",
    "diagnostics": [],
    "diagnostics_truncated": false
  },
  "continuation": {
    "intent": "fresh",
    "next_milestone": "personal-host-integration",
    "reason": "integrated-boundary",
    "detail": "All ASK-0076\u20130078 and three lifecycle exits accepted through source f15b8cc, board acceptance 2366440 and closeout frontier 12a080c; next milestone changes native host and MASK program surfaces. No push/publication, persistent permission change or unrelated migration was performed."
  },
  "acceptance_records": [
    {
      "id": "ASK-0076:*",
      "outcome": "pass",
      "evidence_refs": [
        "docs/rfcs/plans/personal-implement-rfc/ASK-0076.acceptance.json"
      ]
    },
    {
      "id": "ASK-0077:*",
      "outcome": "pass",
      "evidence_refs": [
        "docs/rfcs/plans/personal-implement-rfc/ASK-0077.acceptance.json"
      ]
    },
    {
      "id": "ASK-0078:*",
      "outcome": "pass",
      "evidence_refs": [
        "docs/rfcs/plans/personal-implement-rfc/ASK-0078.acceptance.json"
      ]
    },
    {
      "id": "private-workflow-lifecycle:exit:1",
      "outcome": "pass",
      "evidence_refs": [
        "docs/rfcs/plans/personal-implement-rfc/ASK-0076.public.json",
        "docs/rfcs/plans/personal-implement-rfc/ASK-0078.commit.json"
      ]
    },
    {
      "id": "private-workflow-lifecycle:exit:2",
      "outcome": "pass",
      "evidence_refs": [
        "docs/rfcs/plans/personal-implement-rfc/ASK-0077.lanes.json",
        "docs/rfcs/plans/personal-implement-rfc/ASK-0078.commit.json"
      ]
    },
    {
      "id": "private-workflow-lifecycle:exit:3",
      "outcome": "pass",
      "evidence_refs": [
        "docs/rfcs/plans/personal-implement-rfc/ASK-0076.public.json",
        "docs/rfcs/plans/personal-implement-rfc/ASK-0078.commit.json"
      ]
    }
  ]
}
